[
  {
    "chart_number": 1351,
    "BASE_COMPRESSION": true,
    "ORDERLY_PRICE_DISCOVERY": false,
    "HIGH_TURNOVER_LOW_PRICE_DISPLACEMENT": false,
    "MATURE_EXTENSION_OR_TERMINAL_SPIKE": true,
    "DOWNTREND_OR_BREAKDOWN": false,
    "evidence": "Recent pre-signal sessions form a visibly bounded or compressing base. The signal arrives after a mature extension or terminal price-volume burst.",
    "reviewer": "Codex-root"
  },
  {
    "chart_number": 1352,
    "BASE_COMPRESSION": false,
    "ORDERLY_PRICE_DISCOVERY": false,
    "HIGH_TURNOVER_LOW_PRICE_DISPLACEMENT": false,
    "MATURE_EXTENSION_OR_TERMINAL_SPIKE": false,
    "DOWNTREND_OR_BREAKDOWN": false,
    "evidence": "No frozen signal-time pattern is visually clear.",
    "reviewer": "Codex-root"
  },
  {
    "chart_number": 1353,
    "BASE_COMPRESSION": false,
    "ORDERLY_PRICE_DISCOVERY": false,
    "HIGH_TURNOVER_LOW_PRICE_DISPLACEMENT": false,
    "MATURE_EXTENSION_OR_TERMINAL_SPIKE": false,
    "DOWNTREND_OR_BREAKDOWN": true,
    "evidence": "The pre-signal path shows lower structure, failed repair, or breakdown.",
    "reviewer": "Codex-root"
  },
  {
    "chart_number": 1354,
    "BASE_COMPRESSION": false,
    "ORDERLY_PRICE_DISCOVERY": true,
    "HIGH_TURNOVER_LOW_PRICE_DISPLACEMENT": false,
    "MATURE_EXTENSION_OR_TERMINAL_SPIKE": false,
    "DOWNTREND_OR_BREAKDOWN": false,
    "evidence": "The pre-signal path shows sustained orderly higher structure.",
    "reviewer": "Codex-root"
  },
  {
    "chart_number": 1355,
    "BASE_COMPRESSION": false,
    "ORDERLY_PRICE_DISCOVERY": true,
    "HIGH_TURNOVER_LOW_PRICE_DISPLACEMENT": false,
    "MATURE_EXTENSION_OR_TERMINAL_SPIKE": true,
    "DOWNTREND_OR_BREAKDOWN": false,
    "evidence": "The pre-signal path shows sustained orderly higher structure. The signal arrives after a mature extension or terminal price-volume burst.",
    "reviewer": "Codex-root"
  },
  {
    "chart_number": 1356,
    "BASE_COMPRESSION": false,
    "ORDERLY_PRICE_DISCOVERY": false,
    "HIGH_TURNOVER_LOW_PRICE_DISPLACEMENT": false,
    "MATURE_EXTENSION_OR_TERMINAL_SPIKE": false,
    "DOWNTREND_OR_BREAKDOWN": false,
    "evidence": "No frozen signal-time pattern is visually clear.",
    "reviewer": "Codex-root"
  },
  {
    "chart_number": 1357,
    "BASE_COMPRESSION": false,
    "ORDERLY_PRICE_DISCOVERY": false,
    "HIGH_TURNOVER_LOW_PRICE_DISPLACEMENT": false,
    "MATURE_EXTENSION_OR_TERMINAL_SPIKE": true,
    "DOWNTREND_OR_BREAKDOWN": true,
    "evidence": "The signal arrives after a mature extension or terminal price-volume burst. The pre-signal path shows lower structure, failed repair, or breakdown.",
    "reviewer": "Codex-root"
  },
  {
    "chart_number": 1358,
    "BASE_COMPRESSION": true,
    "ORDERLY_PRICE_DISCOVERY": false,
    "HIGH_TURNOVER_LOW_PRICE_DISPLACEMENT": false,
    "MATURE_EXTENSION_OR_TERMINAL_SPIKE": false,
    "DOWNTREND_OR_BREAKDOWN": false,
    "evidence": "Recent pre-signal sessions form a visibly bounded or compressing base.",
    "reviewer": "Codex-root"
  },
  {
    "chart_number": 1359,
    "BASE_COMPRESSION": true,
    "ORDERLY_PRICE_DISCOVERY": false,
    "HIGH_TURNOVER_LOW_PRICE_DISPLACEMENT": false,
    "MATURE_EXTENSION_OR_TERMINAL_SPIKE": true,
    "DOWNTREND_OR_BREAKDOWN": false,
    "evidence": "Recent pre-signal sessions form a visibly bounded or compressing base. The signal arrives after a mature extension or terminal price-volume burst.",
    "reviewer": "Codex-root"
  },
  {
    "chart_number": 1360,
    "BASE_COMPRESSION": false,
    "ORDERLY_PRICE_DISCOVERY": false,
    "HIGH_TURNOVER_LOW_PRICE_DISPLACEMENT": false,
    "MATURE_EXTENSION_OR_TERMINAL_SPIKE": false,
    "DOWNTREND_OR_BREAKDOWN": true,
    "evidence": "The pre-signal path shows lower structure, failed repair, or breakdown.",
    "reviewer": "Codex-root"
  },
  {
    "chart_number": 1361,
    "BASE_COMPRESSION": false,
    "ORDERLY_PRICE_DISCOVERY": false,
    "HIGH_TURNOVER_LOW_PRICE_DISPLACEMENT": false,
    "MATURE_EXTENSION_OR_TERMINAL_SPIKE": false,
    "DOWNTREND_OR_BREAKDOWN": true,
    "evidence": "The pre-signal path shows lower structure, failed repair, or breakdown.",
    "reviewer": "Codex-root"
  },
  {
    "chart_number": 1362,
    "BASE_COMPRESSION": false,
    "ORDERLY_PRICE_DISCOVERY": false,
    "HIGH_TURNOVER_LOW_PRICE_DISPLACEMENT": false,
    "MATURE_EXTENSION_OR_TERMINAL_SPIKE": false,
    "DOWNTREND_OR_BREAKDOWN": false,
    "evidence": "No frozen signal-time pattern is visually clear.",
    "reviewer": "Codex-root"
  },
  {
    "chart_number": 1363,
    "BASE_COMPRESSION": false,
    "ORDERLY_PRICE_DISCOVERY": false,
    "HIGH_TURNOVER_LOW_PRICE_DISPLACEMENT": false,
    "MATURE_EXTENSION_OR_TERMINAL_SPIKE": true,
    "DOWNTREND_OR_BREAKDOWN": false,
    "evidence": "The signal arrives after a mature extension or terminal price-volume burst.",
    "reviewer": "Codex-root"
  },
  {
    "chart_number": 1364,
    "BASE_COMPRESSION": false,
    "ORDERLY_PRICE_DISCOVERY": true,
    "HIGH_TURNOVER_LOW_PRICE_DISPLACEMENT": false,
    "MATURE_EXTENSION_OR_TERMINAL_SPIKE": true,
    "DOWNTREND_OR_BREAKDOWN": false,
    "evidence": "The pre-signal path shows sustained orderly higher structure. The signal arrives after a mature extension or terminal price-volume burst.",
    "reviewer": "Codex-root"
  },
  {
    "chart_number": 1365,
    "BASE_COMPRESSION": false,
    "ORDERLY_PRICE_DISCOVERY": true,
    "HIGH_TURNOVER_LOW_PRICE_DISPLACEMENT": false,
    "MATURE_EXTENSION_OR_TERMINAL_SPIKE": true,
    "DOWNTREND_OR_BREAKDOWN": false,
    "evidence": "The pre-signal path shows sustained orderly higher structure. The signal arrives after a mature extension or terminal price-volume burst.",
    "reviewer": "Codex-root"
  },
  {
    "chart_number": 1366,
    "BASE_COMPRESSION": false,
    "ORDERLY_PRICE_DISCOVERY": false,
    "HIGH_TURNOVER_LOW_PRICE_DISPLACEMENT": false,
    "MATURE_EXTENSION_OR_TERMINAL_SPIKE": false,
    "DOWNTREND_OR_BREAKDOWN": true,
    "evidence": "The pre-signal path shows lower structure, failed repair, or breakdown.",
    "reviewer": "Codex-root"
  },
  {
    "chart_number": 1367,
    "BASE_COMPRESSION": false,
    "ORDERLY_PRICE_DISCOVERY": true,
    "HIGH_TURNOVER_LOW_PRICE_DISPLACEMENT": false,
    "MATURE_EXTENSION_OR_TERMINAL_SPIKE": true,
    "DOWNTREND_OR_BREAKDOWN": false,
    "evidence": "The pre-signal path shows sustained orderly higher structure. The signal arrives after a mature extension or terminal price-volume burst.",
    "reviewer": "Codex-root"
  },
  {
    "chart_number": 1368,
    "BASE_COMPRESSION": true,
    "ORDERLY_PRICE_DISCOVERY": false,
    "HIGH_TURNOVER_LOW_PRICE_DISPLACEMENT": false,
    "MATURE_EXTENSION_OR_TERMINAL_SPIKE": true,
    "DOWNTREND_OR_BREAKDOWN": false,
    "evidence": "Recent pre-signal sessions form a visibly bounded or compressing base. The signal arrives after a mature extension or terminal price-volume burst.",
    "reviewer": "Codex-root"
  },
  {
    "chart_number": 1369,
    "BASE_COMPRESSION": false,
    "ORDERLY_PRICE_DISCOVERY": true,
    "HIGH_TURNOVER_LOW_PRICE_DISPLACEMENT": false,
    "MATURE_EXTENSION_OR_TERMINAL_SPIKE": false,
    "DOWNTREND_OR_BREAKDOWN": false,
    "evidence": "The pre-signal path shows sustained orderly higher structure.",
    "reviewer": "Codex-root"
  },
  {
    "chart_number": 1370,
    "BASE_COMPRESSION": false,
    "ORDERLY_PRICE_DISCOVERY": false,
    "HIGH_TURNOVER_LOW_PRICE_DISPLACEMENT": false,
    "MATURE_EXTENSION_OR_TERMINAL_SPIKE": false,
    "DOWNTREND_OR_BREAKDOWN": true,
    "evidence": "The pre-signal path shows lower structure, failed repair, or breakdown.",
    "reviewer": "Codex-root"
  },
  {
    "chart_number": 1371,
    "BASE_COMPRESSION": false,
    "ORDERLY_PRICE_DISCOVERY": false,
    "HIGH_TURNOVER_LOW_PRICE_DISPLACEMENT": false,
    "MATURE_EXTENSION_OR_TERMINAL_SPIKE": false,
    "DOWNTREND_OR_BREAKDOWN": false,
    "evidence": "No frozen signal-time pattern is visually clear.",
    "reviewer": "Codex-root"
  },
  {
    "chart_number": 1372,
    "BASE_COMPRESSION": false,
    "ORDERLY_PRICE_DISCOVERY": false,
    "HIGH_TURNOVER_LOW_PRICE_DISPLACEMENT": false,
    "MATURE_EXTENSION_OR_TERMINAL_SPIKE": false,
    "DOWNTREND_OR_BREAKDOWN": true,
    "evidence": "The pre-signal path shows lower structure, failed repair, or breakdown.",
    "reviewer": "Codex-root"
  },
  {
    "chart_number": 1373,
    "BASE_COMPRESSION": false,
    "ORDERLY_PRICE_DISCOVERY": false,
    "HIGH_TURNOVER_LOW_PRICE_DISPLACEMENT": false,
    "MATURE_EXTENSION_OR_TERMINAL_SPIKE": false,
    "DOWNTREND_OR_BREAKDOWN": false,
    "evidence": "No frozen signal-time pattern is visually clear.",
    "reviewer": "Codex-root"
  },
  {
    "chart_number": 1374,
    "BASE_COMPRESSION": false,
    "ORDERLY_PRICE_DISCOVERY": false,
    "HIGH_TURNOVER_LOW_PRICE_DISPLACEMENT": false,
    "MATURE_EXTENSION_OR_TERMINAL_SPIKE": false,
    "DOWNTREND_OR_BREAKDOWN": true,
    "evidence": "The pre-signal path shows lower structure, failed repair, or breakdown.",
    "reviewer": "Codex-root"
  },
  {
    "chart_number": 1375,
    "BASE_COMPRESSION": false,
    "ORDERLY_PRICE_DISCOVERY": false,
    "HIGH_TURNOVER_LOW_PRICE_DISPLACEMENT": false,
    "MATURE_EXTENSION_OR_TERMINAL_SPIKE": false,
    "DOWNTREND_OR_BREAKDOWN": false,
    "evidence": "No frozen signal-time pattern is visually clear.",
    "reviewer": "Codex-root"
  },
  {
    "chart_number": 1376,
    "BASE_COMPRESSION": true,
    "ORDERLY_PRICE_DISCOVERY": true,
    "HIGH_TURNOVER_LOW_PRICE_DISPLACEMENT": false,
    "MATURE_EXTENSION_OR_TERMINAL_SPIKE": false,
    "DOWNTREND_OR_BREAKDOWN": false,
    "evidence": "Recent pre-signal sessions form a visibly bounded or compressing base. The pre-signal path shows sustained orderly higher structure.",
    "reviewer": "Codex-root"
  },
  {
    "chart_number": 1377,
    "BASE_COMPRESSION": false,
    "ORDERLY_PRICE_DISCOVERY": false,
    "HIGH_TURNOVER_LOW_PRICE_DISPLACEMENT": false,